<?xml version="1.0" encoding="utf-8"?>
<profiles xmlns:xsi="http://www.w3.org/2001/XMLSchema-instance" xsi:noNamespaceSchemaLocation="profileSchema.xsd">
	<!--This is a typical 2 processors by 10 physical cores compute node
	  Taken from HP380 -->
	<cpuProfile name="cpu-2x10">
		<processor>
			<!--number of processors on the server-->
			<numberOfProcessor>2</numberOfProcessor>
			<!--number of physical cores in each processor.
			Specify number of the physical cores here.
			To see logical core mapping, turn on the hyper-threading below-->
			<coresPerProcessor>10</coresPerProcessor>
			<!--use optional hyperThreading to enable hyper-thread to the -->
			<!--profile. Enabling hyper-threading will make the profile looks-->
			<!--like what it is as if the host has it hyper-threading enabled. -->
			<hyperThreading>false</hyperThreading>
		</processor>

		<!--platformCores section defines physical cores assign to platform functions on each processor -->
		<platformCores>
			<!--Each processor tag defines number of physical cores to be assigned to platform function on
			a processor indicated by the index.
			processor index starts from 0 to numberOfProcessor -1.
			Each processor (indicated by index) should only appear once-->
			<processor index="0" numberOfCores="1"></processor>
		</platformCores>

		<!--vswitchCores section defines physical cores assign to vswitch functions on each processor
		    This setting only apply to the compute nodes. -->
		<vswitchCores>
			<!--Each processor tag defines number of physical cores to be assigned to vswitch function on
			a processor indicated by the index.
			processor index starts from 0 to numberOfProcessor -1.
			Each processor (indicated by index) should only appear once-->
			<processor index="0" numberOfCores="2"></processor>
		</vswitchCores>

		<!--remaining cores on each processor are assigned to guest VMs-->
	</cpuProfile>

	<!--this setup is taken from HP380 -->
	<memoryProfile name="mem-profile">
		<!--number of CPUs on the motherboard-->
		<numberOfProcessor>2</numberOfProcessor>

		<!--platformReservedMiB section defines the memory to be reserved for platform functions-->
		<platformReservedMiB>
			<!--Each processor tag defines number of physical cores to be assigned to vswitch function on
			a processor indicated by the index.
			processor index starts from 0 to numberOfProcessor -1.
			Each processor (indicated by index) should only appear once.
			The size is in MB-->
			<processor index="0" size="4000"></processor>
			<processor index="1" size="2000"></processor>
		</platformReservedMiB>

		<!--vmHugePages2M section defines number of 2M bytes huge page assigned to each processor-->
		<vmHugePages2M>
			<!--Each processor tag defines number of physical cores to be assigned to vswitch function on
			a processor indicated by the index.
			processor index starts from 0 to numberOfProcessor -1.
			Each processor (indicated by index) should only appear once. -->
			<processor index="0" size="29096"></processor>
			<processor index="1" size="30129"></processor>
		</vmHugePages2M>

		<!--vmHugePages1G section defines number of 1G bytes huge page assigned to each processor-->
		<vmHugePages1G>
			<!--Each processor tag defines number of physical cores to be assigned to vswitch function on
			a processor indicated by the index.
			processor index starts from 0 to numberOfProcessor -1.
			Each processor (indicated by index) should only appear once. -->
			<processor index="0" size="0"></processor>
			<processor index="1" size="0"></processor>
		</vmHugePages1G>
	</memoryProfile>

        <!--This setup is taken from wildcat7_12-->
        <storageProfile name="storage-profile">
            <!--The disk tags below define each device,
            path: device path
            size: minimum size (in GiB)
            volumeFunc: volume function to be assigned to the device
                For 'osd' function:
                    journalSize: the size of the ceph journal in GiB, if absent defaults to journal_default_size in sysinv.conf
                    journalLocation: location of the journal partition, mandatory if multiple journal functions are defined,
                                     if absent defaults to the single available journal drive.
                If no device with journal function is configured then the journals for all OSDs will be collocated on the
                same device with the OSD data (partition #1 is for the data and partition #2 for the journl).
                In this case the size of the journal will be journal_default_size.-->
            <disk path="/dev/sdb" size="223" volumeFunc="osd" journalSize="2" journalLocation="/dev/sdd" />
            <disk path="/dev/sdc" size="223" volumeFunc="osd" journalLocation="/dev/sde" />
            <disk path="/dev/sdd" size="223" volumeFunc="journal" />
            <disk path="/dev/sde" size="223" volumeFunc="journal" />
        </storageProfile>

        <storageProfile name="storage-profile-coloc-no-tier">
            <!--The disk tags below define each device,
            path: device path
            size: minimum size (in GiB)
            volumeFunc: volume function to be assigned to the device
                For 'osd' function:
                    journalSize: the size of the ceph journal in GiB, if absent defaults to journal_default_size in sysinv.conf
                    journalLocation: location of the journal partition, mandatory if multiple journal functions are defined,
                                     if absent defaults to the single available journal drive.
                    tier: storage tier for OSDs. If this is not specified, then the
                          primary system default tier, 'storage', is used.
                If no device with journal function is configured then the journals for all OSDs will be collocated on the
                same device with the OSD data (partition #1 is for the data and partition #2 for the journl).
                In this case the size of the journal will be journal_default_size.
            -->
            <disk path="/dev/disk/by-path/pci-0000:00:0d.0-ata-2.0" size="50" volumeFunc="osd"/>
            <disk path="/dev/disk/by-path/pci-0000:00:0d.0-ata-3.0" size="50" volumeFunc="osd"/>
        </storageProfile>

        <storageProfile name="storage-profile-journal-no-tier">
            <!--The disk tags below define each device,
            path: device path
            size: minimum size (in GiB)
            volumeFunc: volume function to be assigned to the device
                For 'osd' function:
                    journalSize: the size of the ceph journal in GiB, if absent defaults to journal_default_size in sysinv.conf
                    journalLocation: location of the journal partition, mandatory if multiple journal functions are defined,
                                     if absent defaults to the single available journal drive.
                    tier: storage tier for OSDs. If this is not specified, then the
                          primary system default tier, 'storage', is used.
                If no device with journal function is configured then the journals for all OSDs will be collocated on the
                same device with the OSD data (partition #1 is for the data and partition #2 for the journl).
                In this case the size of the journal will be journal_default_size.
            -->
            <disk path="/dev/disk/by-path/pci-0000:00:0d.0-ata-2.0" size="50" volumeFunc="osd"/>
            <disk path="/dev/disk/by-path/pci-0000:00:0d.0-ata-3.0" size="50" volumeFunc="journal"/>
        </storageProfile>

        <storageProfile name="storage-profile-coloc-two-tiers">
            <!--The disk tags below define each device,
            path: device path
            size: minimum size (in GiB)
            volumeFunc: volume function to be assigned to the device
                For 'osd' function:
                    journalSize: the size of the ceph journal in GiB, if absent defaults to journal_default_size in sysinv.conf
                    journalLocation: location of the journal partition, mandatory if multiple journal functions are defined,
                                     if absent defaults to the single available journal drive.
                    tier: storage tier for OSDs. If this is not specified, then the
                          primary system default tier, 'storage', is used.
                If no device with journal function is configured then the journals for all OSDs will be collocated on the
                same device with the OSD data (partition #1 is for the data and partition #2 for the journl).
                In this case the size of the journal will be journal_default_size.
            -->
            <disk path="/dev/disk/by-path/pci-0000:00:0d.0-ata-2.0" size="50" volumeFunc="osd" tier="storage"/>
            <disk path="/dev/disk/by-path/pci-0000:00:0d.0-ata-3.0" size="50" volumeFunc="osd" tier="gold"/>
        </storageProfile>

        <localstorageProfile name="localstorage-profile_lvm">
		<!--The disk tags below define each device,
		        node: device node
		        size: minimum size (in GiB).
                    The lvg tags below define the local volume group 
                        lvm_vg_name: local volume group name
                        instance_backing: lvm, image, or remote
                        instances_lv_size_gib: local volume size in GiB
                        concurrent_disk_operations: number of parallel I/O intensive disk operaions
                -->
           <disk path="/dev/sdb" size="223" />
           <lvg lvm_vg_name="nova-local" instance_backing="lvm" instances_lv_size_gib="2" concurrent_disk_operations="2" />
        </localstorageProfile>

        <localstorageProfile name="localstorage-profile_localimage">
		<!--The disk tags below define each device,
		        node: device node
		        size: minimum size (in GiB).